编号,序号,所属系统,产品名称,故障部位,深层现象,故障现象,故障分析,处理方式,处理方式标签2,处理方式标签,系统标签
R515,515,侦查系统,光电侦察平台,内框架俯仰角位移传感器,内框架俯仰角位移传感器故障,内框架俯仰工作不正常,内框架俯仰角位移传感器故障,更换故障件,1,更换故障件,0
R516,516,侦查系统,光电侦察平台,红外跟踪器,红外跟踪器故障,红外不能正常启动，CCD自动跟踪功能无效,红外跟踪器故障，导致无红外图像，且影响电视跟踪器通讯，从而影响自动跟踪功能,更换故障件,1,更换故障件,0
R517,517,侦查系统,光电侦察平台,红外电源连接器,红外+5V电源连接器接触不良,红外不能正常启动,红外+5V电源连接器接触不良,更换故障件,2,更换故障件,0
R518,518,侦查系统,光电侦察平台,CCD视频线,CCD视频线接触不良,CCD显示有雪花，红外调焦数值不变,CCD视频线接触不良,重新连接CCD视频线,3,维修(无需更换）,0
R518,518,侦查系统,光电侦察平台,红外跟踪器,红外跟踪器故障,红外自动跟踪失效,红外跟踪器故障,更换故障件,1,更换故障件,0
R519,519,侦查系统,光电侦察平台,电源连接器,电源连接器接触不良,CCD摄像机和红外热像仪加电无图像显示,电源连接器接触不良,更换故障件,2,更换故障件,0
R520,520,侦查系统,光电侦察平台,红外电源连接器,红外+5V电源连接器接触不良,可见光电视自动跟踪功能无响应，红外热像仪有图像，跟踪框及十字架没有,红外+5V电源连接器接触不良,更换故障件,2,更换故障件,0
R521,521,侦查系统,光电侦察平台,俯仰感应同步器,外框架俯仰感应同步器激磁信号与设备外壳接触,手动跟踪时图像会抖动，抖动幅度较小，切B柜控制后，现象依然存在,外框架俯仰感应同步器激磁信号与设备外壳接触造成角度值错误，当手动跟踪时，内框架随外框架的角度差转动时必然抖动，图像也随之抖动,重新更换安装感应同步器动片，使激光信号与设备外框架彻底绝缘,2,维修(无需更换）,0
R522,522,侦查系统,光电侦察平台,热像仪,热像仪使用扫描型器件对温度变化敏感,红外图像边缘锯齿状严重，图像模糊,热像仪使用扫描型器件对温度变化敏感，图像景物边缘会根据环境温度和观测景物温度的变化而产生形变,调整热像仪相关温度系数,3,维修(无需更换）,0
R524,524,侦查系统,光电平台吊舱,软件,软件问题,光电平台红外重启，死机,软件问题,对软件进行修改,2,更换故障件，改进设计,0
R526,526,侦查系统,光电侦察平台,控制电位器,控制电位器漂移,空中红外图像变形，横向拉伸,控制电位器漂移,调整故障件,3,维修(无需更换）,0
R527,527,侦查系统,光电侦察平台,软件,软件问题,飞行过程中，光电平台红外重启后死机，一直重启,软件问题,对软件进行调试,3,维修(无需更换）,0
R528,528,侦查系统,光电侦察平台,软件,软件问题,飞行过程中，光电平台红外重启后死机，一直重启,软件问题,对软件进行调试,3,维修(无需更换）,0
R529,529,侦查系统,光电侦察平台,软件,红外热像仪检查正常后，在使用过程中出现自动重启,发应急关电指令，平台方位保持在90度；发红外调焦，指令未响应，红外断电重启后恢复,软件问题,对软件进行调试,3,维修(无需更换）,0
R530,530,侦查系统,光电侦察平台,外俯仰编码器线路,外俯仰编码器线路断开,发应急关电指令后，平台方位找零位后，外框架不能转动,外俯仰编码器线路断开,连接后故障消除,3,维修(无需更换）,0
R531,531,侦查系统,光电侦察平台,软件,软件问题,红外侦察图像忽明忽暗,软件问题,对软件进行调试,3,维修(无需更换）,0
R532,532,侦查系统,光电侦察平台,软件,软件问题,飞机飞行10min后，光电平台无遥测数据,软件问题,对软件进行调试,3,维修(无需更换）,0
R533,533,侦查系统,光电侦察平台,连接螺钉,返回地面后，手动沿俯仰方向轻推平台外壳，俯仰方向抖动现象再现,鉴定试飞时，在目标跟踪过程中发生短暂的俯仰方向抖动,俯仰齿轮箱末级齿轮与同步减速齿轮件连接螺钉松动，导致末级齿轮与同步减速齿轮间有空回，使俯仰方向稳定性能降低，原设定参数高于空回后参数，引起俯仰方向出现振荡现象,使用螺纹胶加固螺钉，外场更换齿轮箱,1,维修(无需更换）,0
R534,534,侦查系统,光电侦察平台,陀螺,陀螺故障,地面检查中发现光电平台有卡滞抖动现象,陀螺故障,返厂维修,1,维修(无需更换）,0
R535,535,侦查系统,光电侦察平台,光电侦察平台,返回过程中光电平台全部关电再加电后，红外启动正常，但图像效果不好，条纹多,飞行中红外发出校正指令进行校正后，出现自动关机报故现象,红外参数漂移,返厂维修,1,维修(无需更换）,0
R536,536,侦查系统,光电平台电控箱,红外驱动摆镜连接器,红外驱动摆镜连接器接触不良,光电平台红外画质抖动，重新加电无好转，红外自动断电重启三次,红外驱动摆镜连接器接触不良,更换故障件,2,更换故障件,0
R537,537,侦查系统,光电侦察平台,激光电源线,激光电源线经过外框俯仰轴处磨损,光电平台的激光器上电后显示电源故障，激光测距功能失效,激光电源线经过外框俯仰轴处磨损，对机壳出现短路，导致激光无电源，平流报故,走线位置重新布局，导线包扎,3,维修(无需更换）,0
R538,538,侦查系统,光电侦察平台,计算机主板BIOS,计算机主板BIOS设置不当，导致硬件冲突，从而造成计算机无法启动,数码相机加装地面试验中，其配套的检测与下载计算机出现不能启动故障,计算机主板BIOS设置不当，导致硬件冲突，从而造成计算机无法启动,重新正确设置计算机主板BIOS,3,维修(无需更换）,0
R539,539,侦查系统,光电侦察平台；红外热像仪,红外元器件,红外元器件失效,红外热像仪不工作，重启后还是无法工作且设备开始不制冷,红外元器件失效,更换故障件,2,更换故障件,0
R540,540,侦查系统,光电侦察平台；数码相机,螺钉,数据相机机箱内固定相机的螺钉较短，且没有点胶加固,数码相机装前检查中，数码相机机箱内固定相机的螺钉脱落,数据相机机箱内固定相机的螺钉较短，且没有点胶加固，导致脱落,更换故障件,3,更换故障件,0
R540,540,侦查系统,光电侦察平台；数码相机,CP卡,CP卡插排没有锁紧,数码相机装前检查中，过数码相机系统检测与下载计算机检查数码相机功能时，数码相机不能拍照,CP卡插排没有完全插入相机内，接触不良导致相机无法拍照,插紧CP卡插排,3,维修(无需更换）,0
R540,540,侦查系统,光电侦察平台；数码相机,螺钉弹性垫圈,机箱和内部固定电路板的螺钉没有弹性垫圈,数码相机装前检查中，机箱和内部固定电路板的螺钉没有弹性垫圈,NA,加装弹性垫圈,3,维修(无需更换）,0
R541,541,测控系统,视距收发组合,机载上行信号电缆,机载上行信号电缆松动,加电1小时后主遥控键出现闪烁，飞控软件开关在正常和不正常间跳动，检验在正确和错误间跳动,机载上行信号电缆松动，接插不良,将电缆紧固后正常,3,维修(无需更换）,2
R542,542,测控系统,卫通天线,止动块,尼龙齿轮变形,天线齿轮卡滞,尼龙齿轮变形,修复故障件,3,维修(无需更换）,2
R543,543,测控系统,卫通天线,止动块,尼龙齿轮有变形,ku卫通天线极限轴有卡滞现象,尼龙齿轮有变形,修复故障件,3,维修(无需更换）,2
R544,544,测控系统,卫通天线,接收单元变频器电源线,重新加电后依然不能锁定,卫通机载天线显示失锁,接收单元变频器电源线脱焊,重新焊接接收单元变频器电源线,3,维修(无需更换）,2
R545,545,测控系统,卫通天线,机载上变频器,机载上变频器增益偏低,卫通功放功率推不到饱和,机载上变频器增益偏低,更换故障件,2,更换故障件,2
R546,546,测控系统,卫通天线,卫通天线,天线未能上电,重要汇流条并网后，卫通天线未正常工作,卫通天线未能上电,对飞机重新加电,3,维修(无需更换）,2
R547,547,测控系统,卫通天线,接收机入口信号电缆,接收机入口信号电缆松动,静态联试时，卫通天线能锁定，发动机开车后，卫通不能锁定,接收机入口信号电缆松动,紧固接收机入口信号电缆,3,维修(无需更换）,2
R549,549,测控系统,卫通天线,插头接线,插头接线松动,空中卫通下行失锁5min，显示为机载卫通天线方位误差电压大，增大机载功率后正常,插头接线松导致接触不良,重新插拔接头线,3,维修(无需更换）,2
R553,553,测控系统,KU功放组合,机载上变频器,机载上变频器增益偏低,地面联试打开KU无线大功率时，功率指标不够，功率无法推到饱和输出,机载上变频器增益偏低导致功率无法饱和,更换故障件,2,更换故障件,2
R554,554,测控系统,KU功放组合,功放保险,功放保险烧坏,地面站显示报故，指示灯不亮,功放保险烧坏,更换故障件,2,更换故障件,2
R555,555,测控系统,KU功放组合,功放保险,功放保险烧坏,功放打开，没有下行信号,功放保险烧坏,更换故障件,2,更换故障件,2
R557,557,测控系统,卫通链路收发组合,机载低噪信号射频电缆,机载低噪信号射频电缆外皮有小孔,卫通功放打开状态下机载天线接收帧和解调器失锁,机载低噪信号射频电缆外皮有孔，与下行信号电缆绑在一起，存在电磁干扰,更换故障件,2,更换故障件,2
R558,558,测控系统,卫通链路收发组合,机载调制器,机载调制器无输出,卫通下行链路无法建立,经查机载调制器无输出,更换故障件,2,更换故障件,2
R559,559,测控系统,卫通链路收发组合,机载变频模块,机载调制解调器输出载波正常，经变频器变频后，调制波形明显增大,飞机上电，卫通链路无下行信号,调制波形被机载变频模块放大导致无信号,更换故障件,2,更换故障件,2
R560,560,测控系统,卫通链路ku功放组合,供电线缆,供电线缆过细,地面联试过程中，机载卫通功放不能正常工作，风扇不转，TX指示灯不亮,在卫通功放功率增大后，供电线缆没有相应加粗，导致供电线路压降过大，功放正常工作时电流达到30A，长时间工作导致保险管发生慢熔,更换故障件,2,更换故障件,2
R563,563,测控系统,卫通链路收发组合,卫通收发组合,进行中频误码环测，加电2小时无误码，使用模拟转发器进行射频环码误测，未发现故障,地面联试时无上行信号，有下行信号,非故障,非故障,4,无故障,2
R565,565,测控系统,卫通链路收发组合,BDC模块,收发组合下变频器输出信号异常,飞行前功能检查时，在注入密钥之后密码通信半小时左右，上行接收帧不锁定,收发组合下变频器输出信号异常，造成解扩解调器由于中频输入信号异常而不能正常解调上行链路遥控数据，最终导致卫通上行链路接收帧失锁，经查为BDC模块故障,更换故障件,2,更换故障件,2
R566,566,测控系统,机载卫通收发组合；机载卫通功放组合,压控振荡器（VCO）,卫通收发组合在返修期间，焊接压控振荡器VCO时清洗不充分，并有助焊剂残留、吸附杂质，这些造成VCO管壳底部污染,飞行过程中，卫通上行、下行链路中断,压控振荡器管壳底部污染，在综合应力条件下，管壳底部接地不良，VCO输出压控灵敏度等参数超差，导致锁相环路不能如锁，致使变频器本振失锁，导致链路中断,更换故障件,2,更换故障件,2
R567,567,测控系统,应答机,应答机,器件失效,应答机敌我识别系统iff接收为0%,器件失效,更换故障件,1,更换故障件,2
R568,568,测控系统,应答机,数据类型,飞控计算机向应答机发送的数据帧标识指令类型字节中的数据为“OON”，而该指令在接口控制文件中无定义,飞行时航管部门发现飞机上升高度1900m后，应答机始终报1900m，当飞机上升高度2700m时应答机依然报1900m,飞控计算机向应答机发送的数据帧标识指令类型字节中的数据在接口控制文件中无定义，故应答机认为此数据帧无效而不处理,将标识指令类型字节中的数据变为有效数据后，应答机即能正确接收处理高度数据,3,软件,2
R571,571,地面站、车辆,1#卫通天线车,卫星频段,所分配的卫星频段有其它大功率通信,卫通天线车自环载噪比过低，导致下行链路失锁,所分配卫星频段有其它大功率通信，挤占卫星资源，造成故障,更换卫星频段,3,维修(无需更换）,3
R572,572,地面站、车辆,2#卫通天线车,卫星频段,所分配的卫星频段有其它大功率通信,卫通天线车自环载噪比过低，导致下行链路失锁,所分配卫星频段有其它大功率通信，挤占卫星资源，造成故障,更换卫星频段,3,维修(无需更换）,3
R573,573,地面站、车辆,2#卫通天线车,调制解调器,器件失效,调制解调器不能正常工作,器件失效,更换故障件,1,更换故障件,3
R577,577,地面站、车辆,2#卫通天线车,右后上箱螺栓,螺栓断裂,车壁右后上箱螺栓断裂,螺栓断裂,更换故障件,2,更换故障件,3
R578,578,地面站、车辆,2#卫通天线车,ODU1,ODU1故障,用ODU1时不能完成调制与解调,ODU1故障,更换故障件,2,更换故障件,3
R585,585,地面站、车辆,1#卫通设备车,UPS,UPS故障,1#卫通设备车UPS无法正常供电，UPS电池有电,UPS故障,厂家维修,1,维修(无需更换）,3
R586,586,地面站、车辆,2#卫通设备车,UPS,UPS故障,UPS无法启动，ALARM灯报警,UPS故障,更换故障件,1,更换故障件,3
R588,588,地面站、车辆,1#卫通设备车,光缆,光缆故障,联试时，光缆不通,光缆故障,更换故障件,2,更换故障件,3
R589,589,地面站、车辆,2#卫通设备车,扩频调制器2,扩频调制器故障,扩频调制器2载波过低，不能满足正常使用,扩频调制器故障,厂家维修故障件,1,维修(无需更换）,3
R590,590,地面站、车辆,1#卫通设备车,电瓶电缆,电瓶电缆松动,油机电瓶没电，油机不能启动,电瓶电缆松导致接触不良,紧固电瓶电缆,3,维修(无需更换）,3
R591,591,地面站、车辆,1#卫通设备车,扩频调制器1,按键失灵,扩频调制器1按键失灵无法进行参数设置,扩频调制器1按键失灵导致无法进行参数设置,厂家现场维修故障件,3,维修(无需更换）,3
R592,592,地面站、车辆,1#卫通设备车,电源插头,电源插头烧坏,电源插头烧坏,NA,更换故障件,2,更换故障件,3
R594,594,地面站、车辆,2#主指挥控制车,视频数字记录仪,视频数字记录仪故障,视频数字记录仪加电后自动重启，硬盘灯显示红色，自动重启两次后，视频数字记录仪重启启动不起来,视频数字记录仪故障,更换故障件,1,更换故障件,3
R595,595,地面站、车辆,2#主指挥控制车,任务控制柜,故障不再复现,任务控制A柜、B柜无法发送指令,NA,非故障,4,无故障,3
R596,596,地面站、车辆,主指挥控制车,网口连接,网口连接错误,任务控制B机柜网络经常出现未连接现象,网口连接错误,更改网口连接,3,维修(无需更换）,3
R597,597,地面站、车辆,主指挥控制车,网线,经计算机重启，软件重启，更换发送卡后，故障现象仍存在,飞控A机柜上行不通,网线不通,更换故障件,2,更换故障件,3
R598,598,地面站、车辆,2#主指挥控制车,散热片,散热片故障,任务控制B柜开机后网络正常，但使用时网络时断时连续，不稳定,散热片故障,重新安装散热片,3,维修(无需更换）,3
R600,600,地面站、车辆,2#主指挥控制车,计算机主板,计算机主板故障,联试中计算机黑屏死机，重启无法进入操作系统,计算机主板故障,更换故障件,2,更换故障件,3
R603,603,地面站、车辆,1#主指挥控制车,飞控图像显示单元,飞控图像显示单元故障,飞控图像显示单元无法显示图像,飞控图像显示单元故障,更换故障件,2,更换故障件,3
R605,605,地面站、车辆,1#主指挥控制车,计算机主板,计算机主板故障,任务控制A柜电脑无法开机,计算机主板故障,更换故障件,2,更换故障件,3
R615,615,地面站、车辆,1#主视距拖车,信号线接口,信号线接口老化,主视距拖车与馈源连接的信号线接口无法拧下,信号线接口老化,更换故障件,2,更换故障件,3
R616,616,地面站、车辆,1#主视距拖车,旋转变压器,旋转变压器故障,转动天线方位旋钮，天线方位数值显示不连续，且停止时天线有抖动，切外控后，在链路监控席位看不到拖车信息,旋转变压器故障,更换故障件,2,更换故障件,3
R617,617,地面站、车辆,2#主视距拖车,视距拖车信号线,视距拖车信号线接反,视距拖车C全向天线与定向天线无法切换,视距拖车信号线接反,重接信号线,3,维修(无需更换）,3
R618,618,地面站、车辆,2#主视距拖车,无线操纵主板,无线操纵主板长时间不动,天线升起时俯仰方向抖动,无线操纵主板长时间不动，出现氧化现象,用酒精擦拭主板,3,维修(无需更换）,3
R619,619,地面站、车辆,2#主视距拖车,减速机齿轮,减速机齿轮与轴中间键松动,天线俯仰不能控制,减速机齿轮与轴中间键松动,将减速机齿轮与轴中间松动的键紧固,3,维修(无需更换）,3
R620,620,地面站、车辆,2#主视距拖车,GPS天线,GPS天线断裂,GPS天线断裂，收不到信号,GPS天线断裂,更换故障件,2,更换故障件,3
R622,622,地面站、车辆,2#主视距拖车,油机,再次检查故障未复现,油机不能启动,NA,非故障,4,无故障,3
R625,625,地面站、车辆,2#副指挥控制车,指令发射卡,指令发射卡故障,任控机柜指令无法发送,任控机柜指令发射卡故障,更换故障件,2,更换故障件,3
R627,627,地面站、车辆,1#副视距拖车,信号线,信号线故障,主遥控发频跟踪时锁时不锁，主遥控闪烁,信号线故障,更换故障件,2,更换故障件,3
R629,629,地面站、车辆,1#副指挥控制车,CMOS电池,CMOS电池故障,任务规划电脑开机时出现“CMOS ERROR”故障,CMOS电池故障,更换CMOS电池,2,更换故障件,3
R631,631,地面站、车辆,1#副指挥控制车,BIOS电池,BIOS电池失效,飞行前检测中，任务规划机柜计算机自动重启，重启后无法进入操作系统,BIOS电池失效,BIOS电池,2,更换故障件,3
R632,632,地面站、车辆,1#副指挥控制车,电源模块,保险丝烧断,飞行前检测时，北斗用户机加电无法正常启动,电源模块故障,更换故障件,2,更换故障件,3
R635,635,地面站、车辆,2#副指挥控制车,计算机主板,计算机主板芯片损坏,任务控制柜的计算机无法启动,计算机主板芯片损坏,更换故障件,2,更换故障件,3
R639,639,地面站、车辆,1#副视距拖车,出气口罩,出气口罩断裂,出气口罩断裂,NA,更换故障件,2,更换故障件,3
R640,640,地面站、车辆,1#副视距拖车,UPS,UPS故障,UPS未能启动，电池指示灯闪烁,NA,更换故障件,2,更换故障件,3
R642,642,地面站、车辆,1号拖车,高频箱电源插头；跟踪接收机外露插头,高频箱电源1分3插头、跟踪接收机外露插头腐化严重,高频箱电源1分3插头、跟踪接收机外露插头腐化严重,NA,更换故障件,2,更换故障件,3
R642,642,地面站、车辆,2号拖车,高频箱电源插头；跟踪接收机外露插头,高频箱电源1分3插头、跟踪接收机外露插头腐化严重,高频箱电源1分3插头、跟踪接收机外露插头腐化严重,NA,更换故障件,2,更换故障件,3
R642,642,地面站、车辆,3号拖车,高频箱电源插头；跟踪接收机外露插头,高频箱电源1分3插头、跟踪接收机外露插头腐化严重,高频箱电源1分3插头、跟踪接收机外露插头腐化严重,NA,更换故障件,2,更换故障件,3
R642,642,地面站、车辆,4号拖车,高频箱电源插头；跟踪接收机外露插头,高频箱电源1分3插头、跟踪接收机外露插头腐化严重,高频箱电源1分3插头、跟踪接收机外露插头腐化严重,NA,更换故障件,2,更换故障件,3
R644,644,地面站、车辆,2#副视距拖车,信号线,主通道收频像闪烁，分接测距单元闪烁,视距链路下行时有时无,主通道收频像闪烁，分接测距单元闪烁，造成视距链路下行时有时无,更换信号线,2,更换故障件,3
R645,645,地面站、车辆,2#副视距拖车,UPS,UPS故障,UPS不能加电,UPS故障,更换故障件,1,更换故障件,3
R653,653,地面站、车辆,2#作战指挥与模拟训练车,电源模块,电源模块故障,无遥测信号，有视频信号,电源模块故障,更换故障件,1,更换故障件,3
R654,654,地面站、车辆,2#作战指挥与模拟训练车,软件,软件版本低,打开BZK-005/A软件，无法选择显示飞机遥测数据,软件版本低,升级软件,2,软件,3
R655,655,地面站、车辆,2#作战指挥与模拟训练车,光缆,光缆故障,2#地面站作模车在联试中有图像无遥测,光缆故障,更换故障件,2,更换故障件,3
R656,656,地面站、车辆,2#作战指挥与模拟训练车,计算机主板,计算机主板故障,计算机启动第三路信号输入视频矩阵无显示,计算机主板故障,更换故障件,2,更换故障件,3
R660,660,地面站、车辆,2#作战指挥与模拟训练车,光缆插头,光缆插头故障,作模车光缆通信故障,光缆插头故障,更换故障件,2,更换故障件,3
R661,661,地面站、车辆,1#作战指挥与模拟训练车,控制站末端电流变换器,电流变换器故障,1号地面站的作模车接收不了遥测信号,控制站末端电流变换器故障,更换故障件,1,更换故障件,3
R662,662,地面站、车辆,外控盒,外控线,外控线故障,外控线信号不正常,外控线故障,更换故障件,2,更换故障件,3
R663,663,地面站、车辆,外控盒,外控线,外控线故障,语音通信故障，主站不能接收外控语音，但外控可接收主站语音,外控线故障,更换故障件,2,更换故障件,3
R665,665,地面站、车辆,情报处理车,UPS1机箱,UPS1机箱自燃,UPS1机箱自燃,设计问题,更改设计，更换故障件,1,更换故障件，改进设计,3
R666,666,地面站、车辆,情报处理车,UPS2机箱,UPS1机箱自燃,UPS2机箱自燃,设计问题,更改设计，更换故障件,1,更换故障件，改进设计,3
R667,667,地面站、车辆,情报处理车,软件,软件故障,视频处理软件“图像采集”时间较长，矫正软件对彩色图像无法进行校正,软件故障,更改软件,2,软件,3
R668,668,地面站、车辆,情报处理站,鼠标,鼠标损坏,情报处理站视频处理2席位视频处理主机启动后死机无法进行键盘鼠标操作，经多次断电重启后仍然不能恢复正常,视频处理主机需要连接鼠标键盘共享器，键盘共享器启动时，要对键盘鼠标进行自检，如果鼠标或键盘工作不正常，则共享器无法正常工作,更换故障件,2,更换故障件,3
R672,672,地面站、车辆,维修检测车,油机排气管,油机排气管与消音器脱开,油机排气管与消音器脱开，废气从脱开处排出,NA,重新固定排气口和消声器结合部分,3,维修(无需更换）,3
R673,673,地面站、车辆,维修检测车,备用电池,备用电池故障,备用电池电压明显降低,备用电池故障,更换故障件,2,更换故障件,3
R678,678,地面站、车辆,1#维修检测车,油机电源,油机电源松动,上电时电源电压低于正常值，调节电压调节旋钮，电压调不到正常值,油机电源松动,紧固油机电源,3,维修(无需更换）,3
R681,681,地面站、车辆,GPS差分地面站,DGPS接收天线,DGPS接收天线损坏,DGPS接收天线损坏，无法接收,NA,更换故障件,1,更换故障件,3
R682,682,地面站、车辆,GPS差分地面站,接收机面板电缆,差分站接收机面板电缆断掉,差分站接收机面板电缆断掉,NA,更换故障件,2,更换故障件,3
R683,683,地面站、车辆,GPS差分地面站,DGPS,DGPS故障,DGPS故障，工作不稳定,NA,更换故障件,1,更换故障件,3
R686,686,地面站、车辆,卫通天线车,天线驱动单元变频器,天线撤收时，故障消失，天线可以正常转动,设备展开的过程中，天线的俯仰不能转动。后接上手提驱动箱后，天线方位、俯仰转动正常,天线驱动单元的变频器受到现场220V交流电出现瞬间的电压波动的影响，造成Lv自保护，引起天线俯仰无法转动,非故障,4,无故障,3
R693,693,地面站、车辆,视频处理2席位,鼠标,鼠标损坏,情报处理站视频处理2席位视频处理主机启动后死机无法进行键盘鼠标操作，经多次断电重启后仍然不能恢复正常,视频处理主机需要连接鼠标键盘共享器，键盘共享器启动时，要对键盘鼠标进行自检，如果鼠标或键盘工作不正常，则共享器无法正常工作,更换故障件,2,更换故障件,3
