编号,序号,所属系统,产品名称,故障部位,深层现象,故障现象,故障分析,处理方式,处理方式标签2,处理方式标签,系统标签
R225,225,地面站、车辆,2#卫通天线车,卫星频段,所分配的卫星频段有其它大功率通信,卫通天线车自环载噪比过低，导致下行链路失锁,所分配卫星频段有其它大功率通信，挤占卫星资源，造成故障,更换卫星频段,3,维修(无需更换）,3
R226,226,地面站、车辆,2#卫通天线车,调制解调器,器件失效,调制解调器不能正常工作,器件失效,更换故障件,1,更换故障件,3
R230,230,地面站、车辆,2#卫通天线车,右后上箱螺栓,螺栓断裂,车壁右后上箱螺栓断裂,螺栓断裂,更换故障件,2,更换故障件,3
R231,231,地面站、车辆,2#卫通天线车,ODU1,ODU1故障,用ODU1时不能完成调制与解调,ODU1故障,更换故障件,2,更换故障件,3
R238,238,地面站、车辆,1#卫通设备车,UPS,UPS故障,1#卫通设备车UPS无法正常供电，UPS电池有电,UPS故障,厂家维修,1,维修(无需更换）,3
R239,239,地面站、车辆,2#卫通设备车,UPS,UPS故障,UPS无法启动，ALARM灯报警,UPS故障,更换故障件,1,更换故障件,3
R241,241,地面站、车辆,1#卫通设备车,光缆,光缆故障,联试时，光缆不通,光缆故障,更换故障件,2,更换故障件,3
R242,242,地面站、车辆,2#卫通设备车,扩频调制器2,扩频调制器故障,扩频调制器2载波过低，不能满足正常使用,扩频调制器故障,厂家维修故障件,1,维修(无需更换）,3
R243,243,地面站、车辆,1#卫通设备车,电瓶电缆,电瓶电缆松动,油机电瓶没电，油机不能启动,电瓶电缆松导致接触不良,紧固电瓶电缆,3,维修(无需更换）,3
R244,244,地面站、车辆,1#卫通设备车,扩频调制器1,按键失灵,扩频调制器1按键失灵无法进行参数设置,扩频调制器1按键失灵导致无法进行参数设置,厂家现场维修故障件,3,维修(无需更换）,3
R245,245,地面站、车辆,1#卫通设备车,电源插头,电源插头烧坏,电源插头烧坏,NA,更换故障件,2,更换故障件,3
R247,247,地面站、车辆,2#主指挥控制车,视频数字记录仪,视频数字记录仪故障,视频数字记录仪加电后自动重启，硬盘灯显示红色，自动重启两次后，视频数字记录仪重启启动不起来,视频数字记录仪故障,更换故障件,1,更换故障件,3
R248,248,地面站、车辆,2#主指挥控制车,任务控制柜,故障不再复现,任务控制A柜、B柜无法发送指令,NA,非故障,4,无故障,3
R249,249,地面站、车辆,主指挥控制车,网口连接,网口连接错误,任务控制B机柜网络经常出现未连接现象,网口连接错误,更改网口连接,3,维修(无需更换）,3
R250,250,地面站、车辆,主指挥控制车,网线,经计算机重启，软件重启，更换发送卡后，故障现象仍存在,飞控A机柜上行不通,网线不通,更换故障件,2,更换故障件,3
R251,251,地面站、车辆,2#主指挥控制车,散热片,散热片故障,任务控制B柜开机后网络正常，但使用时网络时断时连续，不稳定,散热片故障,重新安装散热片,3,维修(无需更换）,3
R253,253,地面站、车辆,2#主指挥控制车,计算机主板,计算机主板故障,联试中计算机黑屏死机，重启无法进入操作系统,计算机主板故障,更换故障件,2,更换故障件,3
R256,256,地面站、车辆,1#主指挥控制车,飞控图像显示单元,飞控图像显示单元故障,飞控图像显示单元无法显示图像,飞控图像显示单元故障,更换故障件,2,更换故障件,3
R258,258,地面站、车辆,1#主指挥控制车,计算机主板,计算机主板故障,任务控制A柜电脑无法开机,计算机主板故障,更换故障件,2,更换故障件,3
R268,268,地面站、车辆,1#主视距拖车,信号线接口,信号线接口老化,主视距拖车与馈源连接的信号线接口无法拧下,信号线接口老化,更换故障件,2,更换故障件,3
R269,269,地面站、车辆,1#主视距拖车,旋转变压器,旋转变压器故障,转动天线方位旋钮，天线方位数值显示不连续，且停止时天线有抖动，切外控后，在链路监控席位看不到拖车信息,旋转变压器故障,更换故障件,2,更换故障件,3
R270,270,地面站、车辆,2#主视距拖车,视距拖车信号线,视距拖车信号线接反,视距拖车C全向天线与定向天线无法切换,视距拖车信号线接反,重接信号线,3,维修(无需更换）,3
R271,271,地面站、车辆,2#主视距拖车,无线操纵主板,无线操纵主板长时间不动,天线升起时俯仰方向抖动,无线操纵主板长时间不动，出现氧化现象,用酒精擦拭主板,3,维修(无需更换）,3
R272,272,地面站、车辆,2#主视距拖车,减速机齿轮,减速机齿轮与轴中间键松动,天线俯仰不能控制,减速机齿轮与轴中间键松动,将减速机齿轮与轴中间松动的键紧固,3,维修(无需更换）,3
R273,273,地面站、车辆,2#主视距拖车,GPS天线,GPS天线断裂,GPS天线断裂，收不到信号,GPS天线断裂,更换故障件,2,更换故障件,3
R275,275,地面站、车辆,2#主视距拖车,油机,再次检查故障未复现,油机不能启动,NA,非故障,4,无故障,3
R278,278,地面站、车辆,2#副指挥控制车,指令发射卡,指令发射卡故障,任控机柜指令无法发送,任控机柜指令发射卡故障,更换故障件,2,更换故障件,3
R280,280,地面站、车辆,1#副视距拖车,信号线,信号线故障,主遥控发频跟踪时锁时不锁，主遥控闪烁,信号线故障,更换故障件,2,更换故障件,3
R282,282,地面站、车辆,1#副指挥控制车,CMOS电池,CMOS电池故障,任务规划电脑开机时出现“CMOS ERROR”故障,CMOS电池故障,更换CMOS电池,2,更换故障件,3
R284,284,地面站、车辆,1#副指挥控制车,BIOS电池,BIOS电池失效,飞行前检测中，任务规划机柜计算机自动重启，重启后无法进入操作系统,BIOS电池失效,BIOS电池,2,更换故障件,3
R285,285,地面站、车辆,1#副指挥控制车,电源模块,保险丝烧断,飞行前检测时，北斗用户机加电无法正常启动,电源模块故障,更换故障件,2,更换故障件,3
R288,288,地面站、车辆,2#副指挥控制车,计算机主板,计算机主板芯片损坏,任务控制柜的计算机无法启动,计算机主板芯片损坏,更换故障件,2,更换故障件,3
R292,292,地面站、车辆,1#副视距拖车,出气口罩,出气口罩断裂,出气口罩断裂,NA,更换故障件,2,更换故障件,3
R293,293,地面站、车辆,1#副视距拖车,UPS,UPS故障,UPS未能启动，电池指示灯闪烁,NA,更换故障件,2,更换故障件,3
R295,295,地面站、车辆,1号拖车,高频箱电源插头；跟踪接收机外露插头,高频箱电源1分3插头、跟踪接收机外露插头腐化严重,高频箱电源1分3插头、跟踪接收机外露插头腐化严重,NA,更换故障件,2,更换故障件,3
R295,295,地面站、车辆,2号拖车,高频箱电源插头；跟踪接收机外露插头,高频箱电源1分3插头、跟踪接收机外露插头腐化严重,高频箱电源1分3插头、跟踪接收机外露插头腐化严重,NA,更换故障件,2,更换故障件,3
R295,295,地面站、车辆,3号拖车,高频箱电源插头；跟踪接收机外露插头,高频箱电源1分3插头、跟踪接收机外露插头腐化严重,高频箱电源1分3插头、跟踪接收机外露插头腐化严重,NA,更换故障件,2,更换故障件,3
R295,295,地面站、车辆,4号拖车,高频箱电源插头；跟踪接收机外露插头,高频箱电源1分3插头、跟踪接收机外露插头腐化严重,高频箱电源1分3插头、跟踪接收机外露插头腐化严重,NA,更换故障件,2,更换故障件,3
R297,297,地面站、车辆,2#副视距拖车,信号线,主通道收频像闪烁，分接测距单元闪烁,视距链路下行时有时无,主通道收频像闪烁，分接测距单元闪烁，造成视距链路下行时有时无,更换信号线,2,更换故障件,3
R298,298,地面站、车辆,2#副视距拖车,UPS,UPS故障,UPS不能加电,UPS故障,更换故障件,1,更换故障件,3
R306,306,地面站、车辆,2#作战指挥与模拟训练车,电源模块,电源模块故障,无遥测信号，有视频信号,电源模块故障,更换故障件,1,更换故障件,3
R307,307,地面站、车辆,2#作战指挥与模拟训练车,软件,软件版本低,打开BZK-005/A软件，无法选择显示飞机遥测数据,软件版本低,升级软件,2,软件,3
R308,308,地面站、车辆,2#作战指挥与模拟训练车,光缆,光缆故障,2#地面站作模车在联试中有图像无遥测,光缆故障,更换故障件,2,更换故障件,3
R309,309,地面站、车辆,2#作战指挥与模拟训练车,计算机主板,计算机主板故障,计算机启动第三路信号输入视频矩阵无显示,计算机主板故障,更换故障件,2,更换故障件,3
R313,313,地面站、车辆,2#作战指挥与模拟训练车,光缆插头,光缆插头故障,作模车光缆通信故障,光缆插头故障,更换故障件,2,更换故障件,3
R314,314,地面站、车辆,1#作战指挥与模拟训练车,控制站末端电流变换器,电流变换器故障,1号地面站的作模车接收不了遥测信号,控制站末端电流变换器故障,更换故障件,1,更换故障件,3
R315,315,地面站、车辆,外控盒,外控线,外控线故障,外控线信号不正常,外控线故障,更换故障件,2,更换故障件,3
R316,316,地面站、车辆,外控盒,外控线,外控线故障,语音通信故障，主站不能接收外控语音，但外控可接收主站语音,外控线故障,更换故障件,2,更换故障件,3
R318,318,地面站、车辆,情报处理车,UPS1机箱,UPS1机箱自燃,UPS1机箱自燃,设计问题,更改设计，更换故障件,1,更换故障件，改进设计,3
R319,319,地面站、车辆,情报处理车,UPS2机箱,UPS1机箱自燃,UPS2机箱自燃,设计问题,更改设计，更换故障件,1,更换故障件，改进设计,3
R320,320,地面站、车辆,情报处理车,软件,软件故障,视频处理软件“图像采集”时间较长，矫正软件对彩色图像无法进行校正,软件故障,更改软件,2,软件,3
R321,321,地面站、车辆,情报处理站,鼠标,鼠标损坏,情报处理站视频处理2席位视频处理主机启动后死机无法进行键盘鼠标操作，经多次断电重启后仍然不能恢复正常,视频处理主机需要连接鼠标键盘共享器，键盘共享器启动时，要对键盘鼠标进行自检，如果鼠标或键盘工作不正常，则共享器无法正常工作,更换故障件,2,更换故障件,3
R325,325,地面站、车辆,维修检测车,油机排气管,油机排气管与消音器脱开,油机排气管与消音器脱开，废气从脱开处排出,NA,重新固定排气口和消声器结合部分,3,维修(无需更换）,3
R326,326,地面站、车辆,维修检测车,备用电池,备用电池故障,备用电池电压明显降低,备用电池故障,更换故障件,2,更换故障件,3
R331,331,地面站、车辆,1#维修检测车,油机电源,油机电源松动,上电时电源电压低于正常值，调节电压调节旋钮，电压调不到正常值,油机电源松动,紧固油机电源,3,维修(无需更换）,3
R334,334,地面站、车辆,GPS差分地面站,DGPS接收天线,DGPS接收天线损坏,DGPS接收天线损坏，无法接收,NA,更换故障件,1,更换故障件,3
R335,335,地面站、车辆,GPS差分地面站,接收机面板电缆,差分站接收机面板电缆断掉,差分站接收机面板电缆断掉,NA,更换故障件,2,更换故障件,3
R336,336,地面站、车辆,GPS差分地面站,DGPS,DGPS故障,DGPS故障，工作不稳定,NA,更换故障件,1,更换故障件,3
R339,339,地面站、车辆,卫通天线车,天线驱动单元变频器,天线撤收时，故障消失，天线可以正常转动,设备展开的过程中，天线的俯仰不能转动。后接上手提驱动箱后，天线方位、俯仰转动正常,天线驱动单元的变频器受到现场220V交流电出现瞬间的电压波动的影响，造成Lv自保护，引起天线俯仰无法转动,非故障,4,无故障,3
R346,346,地面站、车辆,视频处理2席位,鼠标,鼠标损坏,情报处理站视频处理2席位视频处理主机启动后死机无法进行键盘鼠标操作，经多次断电重启后仍然不能恢复正常,视频处理主机需要连接鼠标键盘共享器，键盘共享器启动时，要对键盘鼠标进行自检，如果鼠标或键盘工作不正常，则共享器无法正常工作,更换故障件,2,更换故障件,3
R348,348,动力装置系统,发动机,短舱下罩,未进行发动机预装配,发动机安装到位后，发动机短舱下罩安装孔无法全部对齐，且与发动机短舱上罩无法连接,发动机上、下罩装配不合理,返修下罩，重新钻孔,1,维修(无需更换）,4
R349,349,动力装置系统,发动机,短舱上罩；短舱下罩,预装配时未修配,短舱上罩组件和下罩组件安装后，其后边缘与螺旋桨桨叶表面干涉,预装配时未修配,修锉短舱上、下罩后缘,3,维修(无需更换）,4
R350,350,动力装置系统,发动机,发动机,热车后故障消失,发动机试车过程中，发动机工作异常并伴有喘振现象,冷机状态下，燃油雾化处于临界状态，易产生缺缸燃烧现象，热车后故障消失,非故障,4,无故障,4
R351,351,动力装置系统,发动机,冷却液回流管O型圈,发动机1号缸缸头冷却液弯头处O型圈失效,发动机1号缸缸头冷却液弯头处渗漏,O型圈失效,更换故障件,2,更换故障件,4
R352,352,动力装置系统,螺旋桨,防护贴,螺旋桨无损伤,防护贴裂纹,外物打伤,更换故障件,2,更换故障件,4
R353,353,动力装置系统,螺旋桨,防护贴,螺旋桨无损伤,防护贴裂纹,外物打伤,更换故障件,2,更换故障件,4
R354,354,动力装置系统,螺旋桨,桨距电机,桨距电机烧毁,地面进行桨距大增大减，微减无反应,桨距电机烧毁,更换故障件,1,更换故障件,4
R355,355,动力装置系统,螺旋桨,变距机构,变距机构卡滞,飞机在飞行过程中，桨距大增3次后，继续增桨距无效，但桨距减正常,变距机构卡滞,更换故障件,1,更换故障件,4
R356,356,动力装置系统,螺旋桨,防护贴,螺旋桨运转过程中偶然发生的杂物碰撞损伤,螺旋桨防护贴出现裂纹,螺旋桨运转过程中偶然发生的杂物碰撞损伤,更换故障件,2,更换故障件,4
R357,357,动力装置系统,螺旋桨,桨距电机,变距机构卡滞,调桨距时，桨距减幅度很小,变距机构卡滞,用热风枪给桨距电机加热后,3,维修(无需更换）,4
R358,358,动力装置系统,螺旋桨,桨距电机,变距机构卡滞,桨距减工作不正常,变距机构卡滞,用热风枪给桨距电机加热后,3,维修(无需更换）,4
R359,359,动力装置系统,螺旋桨,桨距电机,变距机构卡滞,大增大减不连续，微增微减无反应,变距机构卡滞,用热风枪给桨距电机加热后,3,维修(无需更换）,4
R360,360,动力装置系统,螺旋桨,桨距电机,变距机构卡滞,大增大减不连续，微增微减无反应,变距机构卡滞,用热风枪给桨距电机加热后,3,维修(无需更换）,4
R361,361,动力装置系统,螺旋桨,桨距电机,镜检发现在三组绕组端头附近有四处断点，断裂位置均位于熔融玻璃封装内,飞机在试车过程中无法对桨距进行增减,可能的原因一，交变热应力累积导致电机绕组的铜线断路或虚接；可能的原因二，绕组高速旋转带来离心剪切力造成铜线疲劳，与交变热应力累积造成的铜线强度下降耦合之后，离心力影响加剧铜线断路,更换故障件,2,更换故障件,4
R362,362,动力装置系统,螺旋桨,桨距电机,镜检发现在三组绕组端头附近有四处断点，断裂位置均位于熔融玻璃封装内,增减桨距无反应,可能的原因一，交变热应力累积导致电机绕组的铜线断路或虚接；可能的原因二，绕组高速旋转带来离心剪切力造成铜线疲劳，与交变热应力累积造成的铜线强度下降耦合之后，离心力影响加剧铜线断路,更换故障件,2,更换故障件,4
R363,363,动力装置系统,冷却液散热器,冷却液散热器,散热器本体损坏,冷却液散热器本体有渗漏,散热器支架安装应力过大导致散热器本体损坏，渗漏冷却液,更换故障件，改进设计,1,更换故障件，改进设计,4
R364,364,动力装置系统,冷却液散热器,冷却液散热器,散热器本体损坏,冷却液散热器局部有渗漏,散热器支架安装应力过大导致散热器本体损坏，渗漏冷却液,更换故障件，改进设计,1,更换故障件，改进设计,4
R365,365,动力装置系统,空滤支架,空滤支架,空滤支架断裂,空滤支架断裂,空滤支架材料强度不够,更换故障件，更改设计,1,更换故障件，改进设计,4
R365,365,动力装置系统,温度传感器,温度传感器线缆,温度传感器线缆破裂,排气2、4缸头温度传感器线缆破裂,振动摩擦导致磨损,更换故障件，并在传感器易磨损部位添加防磨套,2,更换故障件，改进设计,4
R366,366,动力装置系统,发动机,启动油路钢索,启动油路钢索太粗,启动油路回位不彻底，拆卸汽化器时启动油路钢索易打弯、分叉,起动油路钢索太粗，摩擦力过大,更换故障件，更改设计,1,更换故障件，改进设计,4
R367,367,动力装置系统,散热器,散热器支架,处于应力腐蚀环境,散热器支架与发动机机体连接处右侧圆杆断裂,应力腐蚀、过载造成断裂,更换故障件,2,更换故障件,4
R368,368,动力装置系统,废气活门舵机,废气活门舵机,分解故障舵机，舵机角位置传感器合金电刷脱落，经电镜检查未发现有焊接质量问题,地检12V电源开启后，TCU故障警告灯黄色闪烁，废气活门舵机不工作，未自检，弹簧未运动,舵机角位置传感器合金电刷脱落导致废气活门舵机故障，造成无法检测到信号而卡死,更换故障件,1,更换故障件，改进设计,4
R369,369,动力装置系统,燃油油滤口盖,十字螺钉,密封不严,燃油滤口盖处十字螺钉渗油,密封不严,更换故障件，并涂密封胶,2,更换故障件,4
R370,370,动力装置系统,燃油油滤口盖,十字螺钉,密封不严,燃油滤口盖处十字螺钉渗油,密封不严,更换故障件，并涂密封胶,2,更换故障件,4
R373,373,动力装置系统,起动油路,钢索,起动油路钢索与钢索接头连接处有断丝,起动油路钢索与钢索接头连接处有二分之一股断丝,NA,更换故障件,2,更换故障件，改进设计,4
R374,374,动力装置系统,散热器,支架,散热器支架焊点处断裂,地面检查发现散热器支架焊点处断裂,NA,更换故障件,2,更换故障件，改进设计,4
R375,375,动力装置系统,发动机,空气盒压力传感器,查看检测车数据，空气盒压力过高、空气盒温度过高。查看TCU数据，TCU测量的空气盒压力异常,试车过程中，节风门推至100%时，转速达到5700rpm，排气管冒黑烟，并有2次放炮声音,TCU测量的空气盒压力传感器插头接触不良导致测量数据出现“低指”现象，增压系统调节异常，在较大风门状态下，空气盒压力超限，同时带动空气盒温度超温，在此状态下，发动机产生了爆燃和高油燃烧,更换故障件,1,更换故障件，改进设计,4
R377,377,动力装置系统,螺旋桨,前缘防护贴,防护贴开裂,飞行后检查发现，一叶螺旋桨迎风刀面前缘金属保护薄膜出现疑似挤压的褶皱和2条裂纹，存在砂眼,承受较大外力造成防护贴开裂,更换故障件,2,更换故障件，改进设计,4
R378,378,动力装置系统,螺旋桨,桨距电机碳刷,碳刷断裂,在更换桨距电机油脂时，检查发现碳刷断裂成6个碎块,碳刷存在个别产品质量问题,更换螺旋桨变距电机,1,更换故障件,4
R379,379,动力装置系统,螺旋桨,桨距电机碳刷,电机两侧碳刷弹簧断裂，电机后壳断裂,增减桨距无效,碳刷与转子接触不良导致供电断路，导致电机后壳断裂,更换桨距电机,1,更换故障件,4
R381,381,动力装置系统,螺旋桨,桨距电机螺钉螺母垫片,电机内螺钉螺母有划伤，垫片缺失,桨距电机内部螺杆头不固定,螺钉螺母划伤、垫片缺失导致不固定,更换故障件,2,更换故障件,4
R382,382,动力装置系统,螺旋桨,桨距电机,内部短路,桨距电机不工作,桨距电机内部短路导致不工作,更换故障件,1,更换故障件,4
R383,383,动力装置系统,螺旋桨,桨距电机螺杆、碳刷,电机内部螺杆滑丝、碳刷断裂,桨距电机通电不工作,电机内部螺杆滑丝、碳刷断裂导致电机不工作,更换故障件,1,更换故障件,4
R383,383,动力装置系统,螺旋桨,桨距电机,通电检查运行正常，电阻正常,桨距角无法调到最小值,NA,非故障，按规程进行维护后恢复正常变距范围,4,维修(无需更换）,4
R383,383,动力装置系统,螺旋桨,桨距电机齿轮及护套环,通电检查正常，拆解发现齿轮磨损及护套环松动,桨距角无法调到最小值,齿轮磨损及护套环松动导致故障,更换故障件,2,更换故障件,4
R384,384,动力装置系统,螺旋桨,桨距电机端盖,驱动线缆自焊点断裂、螺钉松脱,桨距电机端盖松动,驱动线缆自焊点断裂且由于螺钉松脱导致电机端盖松动,更换桨距电机,1,更换故障件,4
R384,384,动力装置系统,螺旋桨,桨距电机,厂家检查测量最小变距角度为14°，按规程进行变距机构维护，检查各级齿轮及电机无异常,变距角度达不到标准,可能是由于存放时间过长导致油脂粘度增加导致,重新组装故障排除,3,维修(无需更换）,4
R385,385,导弹飞控系统,机载GPS接收机,机载GPS接收机,现场再次通电故障消失,BGPS故障信号灯显示红色,NA,非故障,4,无故障,5
R386,386,导弹飞控系统,机载GPS接收机,机载GPS接收机,第一次通电故障，第二次通电正常,第一次通电时GPS接收机未能正确定位飞机位置，第二次通电正常,器件老化失效,更换故障件,1,更换故障件,5
R387,387,导弹飞控系统,机载GPS接收机,机载GPS接收机,GPS接收机收星颗数少，收星时间长，器件老化,GPS接收机差分状态不稳定,器件老化导致卫星信号接收能力下降，接收灵敏度降低,更换故障件,1,更换故障件,5
R388,388,导弹飞控系统,机载GPS接收机,机载GPS接收机,GPS接收机收星颗数少，收星时间长，器件老化,GPS接收机差分状态不稳定,器件老化导致卫星信号接收能力下降，接收灵敏度降低,更换故障件,1,更换故障件,5
R389,389,导弹飞控系统,机载GPS接收机,机载GPS接收机,后期通电检查，上电3min，导航初始化开始定位；器件老化,飞行联试时，上电40min后差分信号中断,器件老化导致卫星信号接收能力下降，接收灵敏度降低,更换故障件,1,更换故障件,5
R390,390,导弹飞控系统,大气数据计算机,大气数据计算机,该批产品均出现故障,地面联试，左右大气数据计算机气压高度相差10左右,批次性产品质量问题,故障件返厂维修,1,维修(无需更换）,5
R391,391,导弹飞控系统,大气数据计算机,大气数据计算机,该批产品均出现故障,地面联试，左右大气数据计算机气压高度相差10左右,批次性产品质量问题,故障件返厂维修,1,维修(无需更换）,5
R392,392,导弹飞控系统,大气数据计算机,大气数据计算机,该批产品均出现故障,地面联试，左右大气数据计算机气压高度相差10左右,批次性产品质量问题,故障件返厂维修,1,维修(无需更换）,5
R393,393,导弹飞控系统,大气数据计算机,大气数据计算机,该批产品均出现故障,地面联试，左右大气数据计算机气压高度相差10左右,批次性产品质量问题,故障件返厂维修,1,维修(无需更换）,5
R394,394,导弹飞控系统,大气数据计算机,大气数据计算机,该批产品均出现故障,地面联试，左右大气数据计算机气压高度相差10左右,批次性产品质量问题,故障件返厂维修,1,维修(无需更换）,5
R395,395,导弹飞控系统,大气数据计算机,大气数据计算机,该批产品均出现故障,地面联试，左右大气数据计算机气压高度相差10左右,批次性产品质量问题,故障件返厂维修,1,维修(无需更换）,5
R396,396,导弹飞控系统,大气数据计算机,大气数据计算机,该批产品均出现故障,地面联试，左右大气数据计算机气压高度相差10左右,批次性产品质量问题,故障件返厂维修,1,维修(无需更换）,5
R397,397,导弹飞控系统,大气数据计算机,Ps传感器；Pt传感器,Ps、Pt传感器故障,气压高度超高,Ps、Pt传感器故障,更换故障件,2,更换故障件,5
R398,398,导弹飞控系统,大气数据计算机,Ps传感器；Pt传感器,Ps、Pt传感器故障,气压高度超高,Ps、Pt传感器故障,更换故障件,2,更换故障件,5
R399,399,导弹飞控系统,大气数据计算机,Ps传感器；Pt传感器,Ps、Pt传感器故障,气压高度超高,Ps、Pt传感器故障,更换故障件,2,更换故障件,5
R400,400,导弹飞控系统,大气数据计算机,Ps传感器；Pt传感器,Ps、Pt传感器故障,气压高度超高,Ps、Pt传感器故障,更换故障件,2,更换故障件,5
R403,403,导弹飞控系统,无线电高度表,电位器RP2,返厂检测，误差超出正常精度范围-0.3m～0.3m,外场试验中，高度表测量值超出误差范围,电位器RP2调节错误导致误差,调节故障件,3,维修(无需更换）,5
